lemma	pos	date	grouping	identifier	description	context	indexes_target_token	indexes_target_sentence	identifier_system	project	lang	user
virkelighet	NN	2012	2012-2019	2012-2019_virkelighet_17210		Så vi avtaler å møtes i ei busslomme i Eidsvoll, for å kjøre sammen innover i skogen, til Josteins voksne virkelighet.	106:117	0:118	14874	nor_dia_change_subset2	no	andrey
virkelighet	NN	1980	1980-1990	1980-1990_virkelighet_732		I virkelighetens verden finner vi sjelden helt klare skillelinjer mellom institusjonelle og funksjonelle enheter.	2:16	0:113	14881	nor_dia_change_subset2	no	andrey
virkelighet	NN	2012	2012-2019	2012-2019_virkelighet_2550		Ett av disse trekkene er alder, sier Grøntvedt. - Siden kvinner har en høyere grad av fertilitet rundt 20 - 22-årsalderen, forventes det fra et evolusjonaert perspektiv at menn vil søke og ha preferanser for partnere rundt denne alderen, legger han til. - Virkeligheten er mer kompleks	255:268	0:284	14865	nor_dia_change_subset2	no	andrey
virkelighet	NN	2012	2012-2019	2012-2019_virkelighet_8585		I virkeligheten gjør cellegiften henne fryktelig kvalm og fører til at hun kaster opp mye.	2:15	0:90	14873	nor_dia_change_subset2	no	andrey
virkelighet	NN	2012	2012-2019	2012-2019_virkelighet_8517		Det er ingen beundring eller interesse for handlekraften og motet deres. De koster bare penger. Ord skaper virkelighet.	107:118	0:119	14883	nor_dia_change_subset2	no	andrey
virkelighet	NN	1980	1980-1990	1980-1990_virkelighet_144		I de fleste tilfellene har en likevel støttet opp om ansvarsgruppenes valg. Mange av gruppene har i virkeligheten trengt en sterkere oppfølging enn den prosjektet har maktet. Dette vil si at prosjektet ikke har fungert godt nok som veileder, fagkyndig og aktiv oppfølger.	100:113	0:271	14880	nor_dia_change_subset2	no	andrey
virkelighet	NN	1980	1980-1990	1980-1990_virkelighet_1099		Dette har sammenheng med at det er forbundet med en viss usikkerhet å vaere avhengig av offentlige overføringer for at driften skal svare seg, noe som vurderes annerledes av de som allerede er bosatt i området. Øko-krisescenariet forutsetter at det skjer en desentralisering også av varehandelsmønsteret fordi allokeringen av produksjonsfaktorer til ekstraksjonsleddet fører til et mer desentralisert bosettingsmønster. Samtidig som tallene for den fylkesmessige fordelingen er blitt trukket inn, er også de regionale prosesser som ble forsøkt belyst teoretisk i kapittel 2 og praktisk i kapittel 4, mer direkte blitt trukket inn. De regionale mønstre som er blitt beskrevet i dette punktet, er resultatet av prosessenes materialisering i den konkrete virkelighet.	751:762	0:763	14869	nor_dia_change_subset2	no	andrey
virkelighet	NN	1980	1980-1990	1980-1990_virkelighet_808		"Den emosjonelle og etiske kraft, bildets sannhet, ligger i selve det at et innhold er blitt form. Ikke i selve formen, ikke hvorvidt innholdet gjengir en ""korrekt"" sosial virkelighet."	171:182	0:183	14875	nor_dia_change_subset2	no	andrey
virkelighet	NN	2012	2012-2019	2012-2019_virkelighet_7718		Men det kvinnelige blikket gir ofte andre perspektiver på livet, det flirer av andre pinligheter og problematiserer virkeligheten på en annen måte enn mannens øyne gjør.	116:129	0:169	14884	nor_dia_change_subset2	no	andrey
virkelighet	NN	2012	2012-2019	2012-2019_virkelighet_539		Det mange opplevde som høydepunktet var da de to måtte reise seg fra stolene sine under seremonien for å ta imot applausen fra publikum mens de holdt hverandre i hendene. EUs ledere hyllet det europeiske samarbeidet som selve avslutningen av kontinentets blodige krigshistorie. EU-president Herman Van Rompuy, EU-kommisjonens president José Manuel Barroso og EU-parlamentets president Martin Schulz mottok Nobels fredspris for 2012 på vegne av EU. - Her i Oslo vil jeg gi en hyllest til alle de europeerne som drømte om et kontinent forsonet med seg selv, og alle dem som hver eneste dag gjør denne drømmen til virkelighet.	611:622	0:623	14863	nor_dia_change_subset2	no	andrey
virkelighet	NN	2012	2012-2019	2012-2019_virkelighet_14295		– Det er virkeligheten for mange folk. Det blir flott å ha noen i Kongressen som forstår hvor vanskelig det kan vaere, skriver brukeren @llauralouisiana.	9:22	0:152	14864	nor_dia_change_subset2	no	andrey
virkelighet	NN	1980	1980-1990	1980-1990_virkelighet_163		Modellen for mottak og utplassering av flyktninger har gått ut på at de skal utplasseres i boliger og skaffes arbeid etter et kortvarig opphold på et mottakssenter - helst ikke mer enn 6 mndr. I virkeligheten har det vist seg at dette har vaert vanskelig å gjennomføre.	195:208	0:268	14868	nor_dia_change_subset2	no	andrey
virkelighet	NN	2012	2012-2019	2012-2019_virkelighet_186		I virkeligheten var dette penger som Rogaland fylkeskommune skulle betalt. Dersom Stortinget følger rådene til ordfører Jostein Eiane, og	2:15	0:137	14871	nor_dia_change_subset2	no	andrey
virkelighet	NN	2012	2012-2019	2012-2019_virkelighet_11464		I virkeligheten er all ekstremisme et sammensatt fenomen.	2:15	0:57	14872	nor_dia_change_subset2	no	andrey
virkelighet	NN	2012	2012-2019	2012-2019_virkelighet_13710		Våre museer er opptatt av Arktis – som en virkelighet man lever i, som en konstruert forestilling, som samfunn og som land som er både felles og omstridt.	42:53	0:154	14877	nor_dia_change_subset2	no	andrey
virkelighet	NN	1980	1980-1990	1980-1990_virkelighet_1000		Slik må det vaere når vi skulle lage et nordisk skjema uten å gjøre vold på den historiske virkelighet.	90:101	0:102	14866	nor_dia_change_subset2	no	andrey
virkelighet	NN	1980	1980-1990	1980-1990_virkelighet_667		Haugs uttalelse innebaerer vel reelt at mulige midler i utlandet ville vaere uten betydning for forhandlingene mellom partene fordi staten i tilfelle ville legge sin hand på slike midler. Spørsmålet om avtalen av 19. september 1975 i virkeligheten trekker veksler på et usikkert X som representerer midler Reksten-gruppen måtte kunne mobilisere fra utlandet, står der og kan ikke klart besvares.	232:245	0:393	14870	nor_dia_change_subset2	no	andrey
virkelighet	NN	1980	1980-1990	1980-1990_virkelighet_1025		Vi kan på en måte si at nasjonalregnskapssystemet er mer produktivt enn virkeligheten da alle innsats- og sluttleveringskoeffisienter er mindre.	72:85	0:144	14879	nor_dia_change_subset2	no	andrey
virkelighet	NN	1980	1980-1990	1980-1990_virkelighet_1009		Som vi har pekt på allerede tidligere, er det ikke tilstrekkelig å ha kunnskaper om teknologien i seg seiv for å kunne ta stilling til hvilke av disse oppfatninger som står virkeligheten naermest.	173:186	0:195	14867	nor_dia_change_subset2	no	andrey
virkelighet	NN	1980	1980-1990	1980-1990_virkelighet_628		En annen svakhet i beregningene er at avdråtten til husdyra er uavhengig av hva slags f6r dyra får. Dersom en erstatter en del av kraftfdret med grovfdr i f.eks. melkeproduksjonen, vil i virkeligheten melkeytelsen til kua som regel gå ned.	187:200	0:239	14878	nor_dia_change_subset2	no	andrey
virkelighet	NN	2012	2012-2019	2012-2019_virkelighet_922		I virkeligheten hjelper det bare med full aerlighet og total utestengelse av en sykkelleder som systematisk har holdt oss for narr.	2:15	0:130	14876	nor_dia_change_subset2	no	andrey
virkelighet	NN	1980	1980-1990	1980-1990_virkelighet_915		Planlegges reglement utifrå dagens virkelighet kan dette virke ineffektivt ved eventuelle endringer.	35:46	0:100	14882	nor_dia_change_subset2	no	andrey
