lemma	pos	date	grouping	identifier	description	context	indexes_target_token	indexes_target_sentence	identifier_system	project	lang	user
leilighet	NN	1970	1970-2015	1970-2015_leilighet_1226		Leilighetene var pene og komfortable med kort avstand til hotellet. Informasjonsmøtet var kort og greit lagt opp.	104:108	0:113	13777	real_norwegian_semantic_change	no	andrey
leilighet	NN	1929	1929-1965	1929-1965_leilighet_454		Det sterke uttrykk «drive ut» vitner om hvor levende Jesus var gjennomtrengt av følelsen av det påtrengende behov for skikkede medarbeidere. 10, 1: Mens Jesu ord i 9, 37 f. var henvendt til alle de ved leiligheten tilstedevaerende disipler, omtaler Matt. her for første gang en begrenset krets, som han kaller «hans tolv disipler» og deretter (v. 2) «de tolv apostler».	202:213	0:368	13778	real_norwegian_semantic_change	no	andrey
leilighet	NN	1970	1970-2015	1970-2015_leilighet_2513		Bygget ble oppført uten protester fra noen kant. Like lett var det ikke for arkitekt Haakon Kinck i 1969 da han søkte om tillatelse til å oppføre et hybelhus med 120 leiligheter i samarbeid med SAS. Naboen protesterte, og i et ekstraordinaert årsmøte i Snarøen	166:177	0:259	13771	real_norwegian_semantic_change	no	andrey
leilighet	NN	1970	1970-2015	1970-2015_leilighet_1041		Leilighetene i 2. etasje vil få numrene 0201, 0202, 0203 og 0204. Den foreslåtte endringen vil gjøre det mulig å lage statistikk for etasjen, noe som vil vaere nyttig for flere formål.	113:117	0:183	13781	real_norwegian_semantic_change	no	andrey
leilighet	NN	1970	1970-2015	1970-2015_leilighet_532		Ellers er saerlig følgende bestemmelser i husleieloven av betydning for leieforholdet mellom borettslaget og andelseieren: 5 som bestemmer at leieavtalen skal vaere skriftlig hvis en av partene krever det. § 13 om overlevering av utleid leilighet eller rom. Etter 1. og 2. ledd i sistnevnte paragraf skal borettslaget som utleier til avtalt tid stille boligen til rådighet for andelseieren i ordentlig stand.	235:244	0:406	13776	real_norwegian_semantic_change	no	andrey
leilighet	NN	1970	1970-2015	1970-2015_leilighet_1779		For enebolig er gjennomsnittlig egenkapital i 1971 kommet opp i kr. 39 200, —. Gjennomsnittlig tall for egenkapital for hele landet for samtliige boligtyper var i 1971 kommet opp i kr. 29 800, —. En vil i denne forbindelse gjøre oppmerksom på at hovedtyngden av statsansatte arbeider i byer og tettsteder hvor prisene på leiligheter og eneboliger ligger høyere og muligheten for egeninnsats er mindre enn i landsgjennomsnittet.	321:332	0:427	13782	real_norwegian_semantic_change	no	andrey
leilighet	NN	1929	1929-1965	1929-1965_leilighet_1299		— Vi får ta dig med og få rettet på dette, sa doktoren, og før nogen av dem fikk åpnet munnen til takk, lå Benjamin i sykekurven og rakte henne hånden til farvel og bad om å få sendt gangklaerne efter med sikker leilighet.	211:220	0:221	13773	real_norwegian_semantic_change	no	andrey
leilighet	NN	1970	1970-2015	1970-2015_leilighet_1706		Hvis ikke nemnda samtykker i noe annet, skal leiligheten utleies til eller på annen måte tas i bruk av andre for den tid ledigheten varer».	45:56	0:139	13772	real_norwegian_semantic_change	no	andrey
leilighet	NN	1929	1929-1965	1929-1965_leilighet_970		«Å, du ha no inkje so mykje å kjyte a dei du ha skate me stutrefla di, du hell, Hans,» mente Kristen. «Aeg ha no draepe rein, aeg, med mi refle, men du kjem inkje te å råk 'en før du faer deg so lang refle at du kan peike burt på 'en!» Hans benyttet gjerne leiligheten når han var sammen med oss i fjellet, til overfor Kristen å si forskjellige ting mer like ut enn han våget nede i bygden.	253:264	0:386	13774	real_norwegian_semantic_change	no	andrey
leilighet	NN	1970	1970-2015	1970-2015_leilighet_2155		"Toyen fjord nomsnitt Leilighet i datters hus Leilighet 300 m unna Trygdebolig 9 8 12 11 12 1."") L 2 11 11 11 ■M\ 30 38 38 50 17 17 11l 58 17 50 Total (N) |"	0:0	0:155	13770	real_norwegian_semantic_change	no	andrey
leilighet	NN	1970	1970-2015	1970-2015_leilighet_2911		Hvis det er mottatt erf boligskjema —I i leiligheten, fylles det ut og sendes tilbake sammen med alle personskjemaene i svarkonvolutten. SPØRSMÅL 2 Ta med beboelsesrom på 6m 2 eller mer som kan brukes året rundt. Beboelsesrom som ligger adskilt fra leiligheten, men som brukes som en del av leiligheten, regnes med. Rom som kjøkken, bad, gang, entré, hall, trimrom, vaskerom 0.1. skal ikke tas med. Ta heller ikke med rom som bare brukes til naeringsvirksomhet. SPØRSMÅL 3 Med leilighetens størrelse mener vi nettoareal.	41:52	0:519	13784	real_norwegian_semantic_change	no	andrey
leilighet	NN	1929	1929-1965	1929-1965_leilighet_1069		Den følgende vinter opkom der ildløs hos naboen, og ved denne leilighet brente også Jons hus på et kornstål naer. Der blev reddet 2 hester, 8 storfe og 8 sauer, alt det øvrige strøk med. 1 mars samme vinter døde Jon, som imidlertid hadde tatt ophold på Søråker.	62:71	0:260	13788	real_norwegian_semantic_change	no	andrey
leilighet	NN	1929	1929-1965	1929-1965_leilighet_184		Jeg gjorde denne gang som ved tidligere leiligheter den erfaring, at det mest anstrengnde og ofte mest håpløse er a skaffe de nødvendige midler. Staten hadde overlatt mig «Fram» og 75 000 kr. ril a utbedre den for. Dessuten hadde nogen få for den arktiske forskning saerlig interesserte menn dannet en komité med det formål for øie a innsamle bidrag ad privat vei.	40:51	0:363	13769	real_norwegian_semantic_change	no	andrey
leilighet	NN	1970	1970-2015	1970-2015_leilighet_363		Kommunen har ellers ikke noe med formidling av disse leiligheter å gjøre. Nemnda påser videre at ledige leiligheter ikke blir stående tomme, og gir i tilfelle eieren pålegg om å sørge for utleie innen en bestemt frist.	53:64	0:218	13787	real_norwegian_semantic_change	no	andrey
leilighet	NN	1929	1929-1965	1929-1965_leilighet_661		Legemet og sinnet hans var som et svaberg, nyspylt av sjøen i klar blå luft. IX Genia hadde en liten leilighet i Paris hvor Harboe besøkte henne tre-fire ganger om året. Hun vår inderlig kjed av ham. Han hadde ingen som helst sosial bakgrunn, selv om hun gjerne trodde at han hadde en posisjon hjemme i det vesle betydningsløse landet sitt. Selv følte hun sig utenfor. Ikke engang de russiske emigrantene aksepterte henne. I Berlin hadde hun opsøkt en tante av Sergei som mottok henne med omfavnelse og tårer, og neste dag frøs henne ut av huset.	101:110	0:546	13790	real_norwegian_semantic_change	no	andrey
leilighet	NN	1970	1970-2015	1970-2015_leilighet_200		Hun koser seg i leiligheten om morgenen når hun er alene. Hun liker å rusle rundt i slåbrokken før hun kler på seg og spiser frokost. Verken Bente eller	16:27	0:152	13780	real_norwegian_semantic_change	no	andrey
leilighet	NN	1929	1929-1965	1929-1965_leilighet_1196		Da den anledning til fest var gått übenyttet forbi, måtte vi se til å finne en annen, og vi blev da enige om, at overgangen fra den kolde til den tempererte sone var en meget passende leilighet.	184:193	0:194	13779	real_norwegian_semantic_change	no	andrey
leilighet	NN	1970	1970-2015	1970-2015_leilighet_3022		Gjennomsnittlige anleggskostnader for alle leiligheter med husbanktilsagn i 1970 var kr. 115 500, inklusive merverdiavgift.	43:54	0:123	13786	real_norwegian_semantic_change	no	andrey
leilighet	NN	1929	1929-1965	1929-1965_leilighet_1374		Som vi ble eldre, kom leilighetene sjeldnere, men lengselen ble derved bare oppdemmet i oss, og de øyeblikk vi så kunne vaere sammen, fikk efterhånden, oss seiv übevisst, en annen karakter enn den gamle barnslige.	22:34	0:212	13783	real_norwegian_semantic_change	no	andrey
leilighet	NN	1929	1929-1965	1929-1965_leilighet_1011		Det var Viviana som var kommet. Litt efter hørte de henne bruse frem gjennem leiligheten efterfulgt av Hammel, idet hun eksaltert gjentok: — Stans mig ikke!	77:88	0:156	13785	real_norwegian_semantic_change	no	andrey
leilighet	NN	1929	1929-1965	1929-1965_leilighet_1391		Ved skjaeret fra natthuset, som undertiden lyste på ham, syntes Nils at han så gråblek ut. Nils hadde på hjertet å si noe, men han så ikke ut som det var rådelig. «Faller av tre, fire streker, kaptein» varskudde han «sydost til ost!» «Mersseilet skjevrer!» lød det forut fra «vil slå bakk!» «Skuten er gammel, kaptein! hun tåler ikke megen handtering for stengene,» våget endelig Nils i all lunhet å innbringe; han syntes det nu var leilighet for et ord. «Jeg skal vise deg at jeg kan få treskoen til å gå jeg!» mumlet Salve innett, idet han lot som om han hadde overhørt hva der var sagt. «Fall av, Nils! Hun må ha mere fart; og så over på ny baug!» var hans svar i kommandotone.	432:441	0:679	13775	real_norwegian_semantic_change	no	andrey
leilighet	NN	1929	1929-1965	1929-1965_leilighet_270		Han hadde hatt en slags tro på, at hans skjebne skulde bli avgjort i denne dag, om ikke nettop med det likefremme, avgjørende spørsmål, — litt leilighet skal der jo til allting, — så dog av hennes øine og hele vesen.	143:152	0:216	13789	real_norwegian_semantic_change	no	andrey
