lemma	pos	date	grouping	identifier	description	context	indexes_target_token	indexes_target_sentence	identifier_system	project	lang	user
rev	NN	1970	1970-2015	1970-2015_rev_144		Vår økende produksjon av avfall fører til faunaendringer, ofte til gunst for de mindre skattede viltartene og til ulempe for det mer verdifulle viltet. Forekomstene av renovatører som kråker, måker og rev i visse landskapstyper naer byer og sentra er økende.	201:204	0:257	14708	nor_dia_change_subset1_2	no	andrey
rev	NN	1929	1929-1965	1929-1965_rev_98		En skulle tro de ingen fiender hadde her, men reven har de da. Vi fant en rev i praktfullt hvitt vinter-skinn. Den er vel blitt drept med gift om vinteren og er kommet seg unna, så den ikke er blitt funnet.	46:49	0:206	14694	nor_dia_change_subset1_2	no	andrey
rev	NN	1970	1970-2015	1970-2015_rev_89		"Dette innebaerer at det også tar lang tid å ""lege"" denne typen skade. Det er også uvisst i hvilken grad er ødelagt rev vil vokse tilbake på samme sted og hvor store korallkoloniene eller revene må bli før den fulle økologiske betydningen for andre invertebrater og viltlevende marine ressurser gjenopprettes. 2 Politiske erklaeringer og handlingsprogrammer av betydning for forvaltningen av viltlevende marine ressurser 2.1 FAOs atferdskodeks for ansvarlig fiskeri og løpende fiskerirådgivningsarbeid"	114:117	0:498	14706	nor_dia_change_subset1_2	no	andrey
rev	NN	1970	1970-2015	1970-2015_rev_45		Utforming og tilrettelegging av kunstige rev er i hovedsak motivert ut fra mulighetene for å øke tilgangen på skjul for hummer.	41:44	0:127	14698	nor_dia_change_subset1_2	no	andrey
rev	NN	1929	1929-1965	1929-1965_rev_156		Omskriving til ordrett tale. Tidlig en morgen hadde en hane fløyet opp på et gjerde og satt seg til å gale. Så kom det en rev luskende.	122:125	0:135	14702	nor_dia_change_subset1_2	no	andrey
rev	NN	1929	1929-1965	1929-1965_rev_112		Han forbyr sine menn å ta rev i seilene; heller skal de stramme hvert rep så hardt de kan. Torsdagen den 14. juni, over middag, seiler kong Magnus inn på Bergens våg. Svina-Peter, som intet har hørt om kongens ferd og ikke har mannskap nok til motstand, gir sig på flukt.	26:29	0:271	14691	nor_dia_change_subset1_2	no	andrey
rev	NN	1929	1929-1965	1929-1965_rev_210		Jeg famlet videre langs hyllen under taket; stod med et halvt smil og så på. Her hadde der i gamle dager stått en nevereske med godkvae, som vi av og til stjal av. Og lenger inne hadde den ligget, den slitte kortleken som vi hadde sveltet rev med kveld efter kveld på den vesle krakken ved åren. Nu var her tomt, renskurt, men tomt. Borte i det andre hjørnet stod et grønnmalt skap.	239:242	0:382	14697	nor_dia_change_subset1_2	no	andrey
rev	NN	1929	1929-1965	1929-1965_rev_239		Der måtte tas rev og brases. Bare, bare han først hadde viklet opp hennes hår, ropte hvm. 11— Lie IV Men da hun så at han allikevel tok til sjøtrøyen, kastet hun seg annene på ham for å holde ham tilbake. Ikke nyttet det å tale forstand til henne.	14:17	0:247	14696	nor_dia_change_subset1_2	no	andrey
rev	NN	1970	1970-2015	1970-2015_rev_62		Det må holdes oppsyn med om grevling, rev eller rotter graver huller som svekker flomverket. Videre bør traer på selve flomfyllingen holdes nede, da store røtter kan føre til lekkasjeveier i flomverket, ved siden av at tilsynsmulighet og adkomst i kritiske situasjoner kan bli vanskeliggjort. I forkant av flommer må det ses til at rør med enveisventiler, pumper m.v. fungerer som de skal.	29:32	0:388	14705	nor_dia_change_subset1_2	no	andrey
rev	NN	1929	1929-1965	1929-1965_rev_14		Undertiden var )'eg ogßa med nam og Bk)'st da gjerne en rev, for lian var alltid 8a galant a Btille meg pa den oeßte poßt. K.om man inn til nam en vinteraften, kunne lianß Btue fremkv et nvggelig, )'a malerißk Bvn. Oer nang gevirene med kruttsv pa den ene veggen, fißkeßn«rer pa, den andre. Han Batt ved Bitt verkßted, konen og et par dstre ved rokken og kardene, en Bsnn Bto ved ovnen i ferd med a fla en rev eller et ekorn. Ovnsmuren var besatt med belger på blokk, og små brett med ekornskinn var hengt opp under taket til tørk.	56:59	0:531	14701	nor_dia_change_subset1_2	no	andrey
rev	NN	1970	1970-2015	1970-2015_rev_29		Gifta tok også knekken på mye rev og ravn. Rypa har Bruk av land og vann i Finnmark i historisk perspektiv Del 111 Kapittel 3 vaert hovedviltet i dette århundret.	30:33	0:161	14703	nor_dia_change_subset1_2	no	andrey
rev	NN	1929	1929-1965	1929-1965_rev_113		Og no er det storm. Lauris har ikkje hug til å fara aleine med Odin; men det blir til det likevel.) Så bar det i veg. Ut vågen segla dei, med rev i storseglet; men frammed bergstrendene sørover var kastevinden så grov at dei måtte ned med seglet og leggje seg på årane. Vinden kasta tvert av land der. Under ein og annan hamaren var det livt som ein kom i hus, berre eikor droga kvefta ned ovan lufta og varskudde; men ut småvikane og ned skarda stod han i gneistande frøs, og hardare støytar slo ned rett som det var, og ville ta årane frå dei.	142:145	0:545	14688	nor_dia_change_subset1_2	no	andrey
rev	NN	1929	1929-1965	1929-1965_rev_223		Reven på gagle-myrane.	0:4	0:22	14693	nor_dia_change_subset1_2	no	andrey
rev	NN	1970	1970-2015	1970-2015_rev_76		Regner en dessuten med også lam yngre enn 4 uker blir bildet noe helt annet. Det er også på det rene at saerlig rev og ravn gjør skade på reinkalver, men en har ingen holdepunkter for hvor store disse skader er. Men slike skader antas bare å ha noen betydning mens kalvene er små, dvs. bare i et meget begrenset tidsrom og bare på meget begrensede områder.	111:114	0:355	14700	nor_dia_change_subset1_2	no	andrey
rev	NN	1970	1970-2015	1970-2015_rev_121		Det foreligger ingen tall for verdien av dette. Som en kuriositet kan nevnes at en person i Fjellbygda i Malangen fortalte at da han giftet seg i 1950 livnaerte han seg og sin kone med å jakte på rype, hare og rev og fiske i vatnene rundt om i naerområdet. - bruk under 0.5 årsverk - bruk mellom 0.6 og 1.1 årsverk - bruk over 1.2 årsverk Begrunnelsen for å dele opp brukene slik er at ved en årsverksinnsats under 0.5 årsverk er en nødt til å ha inntekter ved siden av. Over 1.2 årsverk skal en normalt kunne leve av inntektene fra gardsbruket.	209:212	0:543	14704	nor_dia_change_subset1_2	no	andrey
rev	NN	1929	1929-1965	1929-1965_rev_145		Reven hadde ett — .	0:4	0:19	14707	nor_dia_change_subset1_2	no	andrey
rev	NN	1929	1929-1965	1929-1965_rev_188		Omtrent 2 km utenfor bunnen av Sjunkfjord er der et rev tvers over fjorden, og på begge sider like overfor det ligger der på land morénepartier. Dette tyder på, at revet dannes av en endemoréne. V 2 km innenfor revet ligger der atter morénepartier midt imot hinannen på begge land, visende, at breen utefter fjorden også her har gjort en stans. Innerst i Sjunkfjord ved Sjunkfjord gard ligger der et parti av en endemoréne. Dens øvre del ved fjellsiden har terrasseform med høide svarende til strandlinjenivået. Breen fra Naevelsfjord har antagelig gått vestover efter den dalformede innsenkning, hvori Ryetvatn og Fjaerevatn ligger.	52:55	0:631	14689	nor_dia_change_subset1_2	no	andrey
rev	NN	1970	1970-2015	1970-2015_rev_122		Det var mye rev og grevling her. Kommunen eksproprierte mer og mer av gården til sine formål som skole, veier, idrettsplass etc.	12:15	0:128	14687	nor_dia_change_subset1_2	no	andrey
rev	NN	1970	1970-2015	1970-2015_rev_128		Nordkysten har en rekke mindre fuglefjell som er nøkkelbiotoper i dette ekstremt golde området. Nordaust-Svalbard naturreservat har faste bestander av rev og rein og et område hvor det alltid er isbjørn. I de øst- og vestlige områdene er det flere kjente liggeplasser for hvalross, og Kong Karls Land er kjerneområdet for den reproduserende delen av isbjørnbestanden. Nordaust-Svalbard naturreservat er oppført på UNESCCs liste over biosfaere-reservat.	151:154	0:451	14692	nor_dia_change_subset1_2	no	andrey
rev	NN	1970	1970-2015	1970-2015_rev_115		Utformingen av kunstige rev må tilpasses målsetningen og seiv om flere typer er kjent fra litteraturen, er det stort potensiale i ny utvikling. Kunstige rev kan skape oaser med sukkertare, andre alger og dyr og økt biologisk mangfold vil påvirke naerliggende forringede områder med økt biologisk aktivitet og vaere kilde for spredning av arter og til gjenvekst av sukkertareskog.	24:27	0:377	14695	nor_dia_change_subset1_2	no	andrey
rev	NN	1929	1929-1965	1929-1965_rev_229		Det følges nå en driftsplan med rydding og planting og skogsbilvei er anlagt. I skogen på Mulåsen er det et rikt fugleliv, saerlig om våren, med rugdetrekk og her spiller århanen. Her trives også rådyr og hare med rev som en hyppig gjest.	213:216	0:237	14690	nor_dia_change_subset1_2	no	andrey
rev	NN	1970	1970-2015	1970-2015_rev_146		"Helt sentralt står Lorenz Crells Die neuesten Entdeckungen in der Chemie i 11 bind (1781-1783), som er en videreføring av Chemische Journal fur die Freunde der Naturlehre, Arzneygelahrtheit, Haushaltungskunst und Manufacturen, verdens første kjemiske tidsskrift, som Crell startet i 1778. Crell var en viktig støttespiller for den flogistiske kjemien i Tyskland på 1790-tallet mot den økende innflytelsen fra den ""nye franske kjemi"", som for alvor fikk rev i seilene etter Antoine Laurent Lavoisiers publisering av Traité élémentaire de chimie i revolusjonsåret 1789. Parallellt med disse hovedstrømningene var det en fornyet interesse for 1500- og 1600-tallets alkymistiske forfattere."	453:456	0:686	14699	nor_dia_change_subset1_2	no	andrey
