lemma	pos	date	grouping	identifier	description	context	indexes_target_token	indexes_target_sentence	identifier_system	project	lang	user
tape	NN	1980	1980-1990	1980-1990_tape_260		Fullverdif orsikring for bygninger ble lansert i krigsårene og er etter hvert blitt et viktig middel til å motvirke underforsikring av verdier. Hadde forsikringstakeren en for lav forsikringssum, ble erstatningen redusert i samme grad som forsikringssummen var lavere enn den virkelige verdi. Produktene i skadeforsikring tar sikte på situasjoner som omfattes av «klassiske» forsikringsbegreper - som at skaden eUer tapet skal skje uventet og tilfeldig og ved en uforutsett begivenhet.	416:421	0:485	15042	nor_dia_change_subset2	no	andrey
tape	NN	2012	2012-2019	2012-2019_tape_5554		Ifølge Oljefondets direktør Yngve Slyngstads resultatpresentasjon falt verdien av fondets BP-aksjer med 8,3 milliarder i andre kvartal i 2010 - det største tapet på en enkeltinvestering i det kvartalet.	156:161	0:202	15044	nor_dia_change_subset2	no	andrey
tape	NN	1980	1980-1990	1980-1990_tape_528		Overfor disse må ansvarsgrunnlaget etter alminnelige rettsgrunnsetninger enten vaere garanti eller rettsbrudd. Erstatningsregelen i fjerde punktum gir bare adgang til å kreve erstatning så langt tapet skriver seg fra at den som står for salget har utvist skyld eller det foreligger annet grunnlag. Erstatningen er imidlertid ikke nødvendigvis betinget av at det foreligger mangler.	194:199	0:380	15052	nor_dia_change_subset2	no	andrey
tape	NN	2012	2012-2019	2012-2019_tape_14425		Overraskende stort underskudd for Tesla FOTO: David Zalubowski, TT Nyhetsbyrån. Teslas inntekter økte, men langt fra så mye som markedet hadde forventet. I årets første kvartal tapte elbilprodusenten over 700 millioner dollar. Tesla hadde på forhånd varslet et underskudd etter at det for første gang i sin 15 år lange historie avsluttet 2018 med overskudd i to kvartaler på rad. Tapet i første kvartal på 702 millioner dollar (rundt 6 milliarder kroner), kommer til tross for at omsetningen økte med nesten 40 prosent til 3,5 milliarder dollar. Dette er likevel langt mindre enn markedets forventninger på 5,42 milliarder dollar i omsetning.	177:182	0:642	15040	nor_dia_change_subset2	no	andrey
tape	NN	1980	1980-1990	1980-1990_tape_144		Tallene kan tyde på noe lavere sykmeldingsfrekvens blant prosjektpasienter enn blant ordinaere pasienter, men forskjellen er ikke stor. Tabell 25. Andel med selvrapportert sykmelding på henvisningstidspunktet blant pasienter behandlet henholdsvis ordinaert og i prosjekt ved Moss sykehus okt. 87 - mai 89. Ved Sarpsborg sykehus er det vanskelig å anslå omfanget av sykefråvaer blant prosjektpasientene på grunn av det store tapet av data fra databasen for behandlede pasienter (jfr. avsnitt 1.5).	421:426	0:493	15036	nor_dia_change_subset2	no	andrey
tape	NN	1980	1980-1990	1980-1990_tape_165		Erstatningen for fremtidig tap skal dermed i prinsippet utgjøre det fulle fremtidige tapet slik dette fortoner seg på tidpunktet for oppgjøret.	27:30	0:143	15053	nor_dia_change_subset2	no	andrey
tape	NN	1980	1980-1990	1980-1990_tape_588		Erstatningsordningene gjelder dessuten bare ulykker som et anlegg i en konvensjonsstat er ansvarlig for. b. Dersom tapet overstiger det begrensningsbeløpet som anleggsinnehaveren er ansvarlig for, bestemmer tilleggskonvensjonen at den stat hvor anlegget hører hjemme, skal vaere ansvarlig for det overskytende opp til 120 millioner SDR, ca 1,1 milliarder kroner, jfr. atomenergiloven § 40 jfr. § 41. (Ansvaret skal neves til 300 millioner SDR, ca 2,7 milliarder kroner.) Anleggsstaten skal dessuten vaere subsidiaert ansvarlig for at anleggsinnehaverens ansvar blir oppfylt, jfr. atomenergiloven § 39. Etter tilleggskonvensjonen skal det land som utbetaler erstatningsbeløp over 70 millioner SDR (som skal heves til 120 millioner SDR), kunne kreve regress av de andre konvensjonsstatene etter en bestemt fordelingsnøkkel.	115:120	0:818	15050	nor_dia_change_subset2	no	andrey
tape	NN	2012	2012-2019	2012-2019_tape_7222		Tapet for laererne var forskjellen i ny og gammel lønn fra 1. mai til 1. september.	0:5	0:82	15037	nor_dia_change_subset2	no	andrey
tape	NN	2012	2012-2019	2012-2019_tape_3950		Hun var kritisk og kunnskapsrik nok. I dette sportsstudioet var det ingen kamp om den rette forståelsen av sykkelteknikk eller dopingmetoder der en av tidenes mest profesjonelle utøvere pr. definisjon ikke kunne tape.	212:216	0:217	15043	nor_dia_change_subset2	no	andrey
tape	NN	1980	1980-1990	1980-1990_tape_224		Forsikringsordningen er bygget opp slik at tapet regnes opp til en fastsatt maksimums årslønn som pr. 1.4.1986 utgjorde kr. 219 500.	43:48	0:132	15049	nor_dia_change_subset2	no	andrey
tape	NN	1980	1980-1990	1980-1990_tape_45		Forretningsdelen bør drives etter forretningsmessige kriterier basert på konkurransevilkår som er mest mulig like dem som det private marked har. Samtidig bør forretningsdelen drives med størst mulig profesjonalitet og gjennomføringsansvar i driften. Dette forutsetter bl.a. at selvfinansieringsprinsippet legges til grunn, slik at premieinntektene blir tilstrekkelige til å dekke tapene samt den del av de felles driftsutgifter som kan henføres til forretningsdelen. EF-landene er i ferd med å omlegge sine garantiordninger for handel innenfor EF-området, slik at garantigivning på kortsiktige kommersielle kreditter skal gjøres helt ut selvfinansierende.	381:387	0:656	15048	nor_dia_change_subset2	no	andrey
tape	NN	1980	1980-1990	1980-1990_tape_393		Men ofte snakkes det om kompensasjon også når produksjonen og inntektsopptjeningen i samfunnet vil bli redusert, og det er snakk om mye mer enn at produktivitetsøkningen oppveier dette tapet med et kort etterslep i tid.	185:190	0:219	15038	nor_dia_change_subset2	no	andrey
tape	NN	1980	1980-1990	1980-1990_tape_172		Og det er nå innført en yrkesskadeforsikring som vil dekke hele tapet også for disse skadene. Utvalget foreslår på denne bakgrunn at det ikke skal ytes uførepensjon ved lavere uføregrader enn 30 prosent.	64:69	0:203	15046	nor_dia_change_subset2	no	andrey
tape	NN	2012	2012-2019	2012-2019_tape_14352		Det måtte tilsynelatende en skandale til for at han skal tape.	57:61	0:62	15056	nor_dia_change_subset2	no	andrey
tape	NN	1980	1980-1990	1980-1990_tape_439		Med den sterke ekspropriasjonstankegang som ligger bak beregningene (utbytte pr. km 2 skal erstattes), virker det videre inkonsekvent å legge til grunn en samfunnsskapt verdi ved beregning av tapets størrelse (se mindretallets uttalelse under kap. XIII 1.4 b).	192:198	0:260	15035	nor_dia_change_subset2	no	andrey
tape	NN	2012	2012-2019	2012-2019_tape_15312		Tapet onsdag var PSGs annet på bare noen få dager og det tredje totalt i serien denne sesongen. Søndag tapte serielederen hele 1-5 mot Lille. Det åpnet riktignok lovende for storklubben.	103:108	0:186	15051	nor_dia_change_subset2	no	andrey
tape	NN	2012	2012-2019	2012-2019_tape_15582		"Selv om vi i forrige punkt presiserte at du bør vaere konkret, skal folk få lyst på det du selger også. I stedet for å skrive ""Reise til Barcelona for to"", vil det vekke mer engasjement å beskrive sand under taerne, kjøpesenter et stykke unna, og herlig tapas på hvert gatehjørne. #4. Pris riktig"	252:257	0:294	15039	nor_dia_change_subset2	no	andrey
tape	NN	1980	1980-1990	1980-1990_tape_143		Ved dom kan det imidlertid bestemmes at et senere registrert frivillig rettserverv skal gå foran det tidligere registrerte. Vilkårene for dette er: 1. at erververen av den senere registrerte rett var i god tro da hans erverv ble dagbokført, 2. at erververen om hans rett skulle stå tilbake, ville lide uforskyldt tap fordi han har stolt på skipsregisteret, og 3. at tapet for erververen ville vaere vesentlig større enn for den annen om dennes rett måtte vike, eller at det ville føre til vesentlige forstyrrelser i senere registrerte rettsforhold om den registrerte, men feilaktig innførte rett skulle gå foran.	313:316	0:611	15041	nor_dia_change_subset2	no	andrey
tape	NN	2012	2012-2019	2012-2019_tape_748		- Til tross for tapet av fem naere kolleger, og med ett fly for lite, har de stått på og løst sine oppdrag. På toppen av det har de evnet å stille ett fly med mannskap til tjeneste i Afghanistan nå fra september, sier Strøm-Erichsen.	16:21	0:232	15054	nor_dia_change_subset2	no	andrey
tape	NN	2012	2012-2019	2012-2019_tape_11735		På kjøtt, sjømat og grønnsaker er det en stor uutnyttet råvarerikdom, sier han. At Dalelv vinner denne konkurransen med en faglig komplisert, men enkel oppskrift på torsk som urørt råvare, håper Sørvig kan bidra til å en ny interesse rundt den kreativiteten en tapas åpner for. - Tapas er på en måte «miniatyrkjøkken», der smakskombinasjoner fra mange råvarer skal harmonere i ett tygg.	261:266	0:386	15047	nor_dia_change_subset2	no	andrey
tape	NN	2012	2012-2019	2012-2019_tape_12250		Tapet var én ting – de ville ikke etterlate søppel på tribunen.	0:5	0:63	15045	nor_dia_change_subset2	no	andrey
tape	NN	2012	2012-2019	2012-2019_tape_762		De har 5-1-2 på hjemmebane, men tapene kom tidlig i sesongen. Klubben har ingen nye skadeproblemer.	32:38	0:99	15055	nor_dia_change_subset2	no	andrey
